{
  "$schema": "https://json-schema.org/draft/2020-12/schema",
  "$id": "https://fiduciary-wire/schemas/meta.schema.json",
  "title": "meta.json",
  "description": "Refresh metadata and per-source status. Read first by every view.",
  "type": "object",
  "properties": {
    "schema_version": {
      "const": 1
    },
    "generated_at": {
      "type": "string",
      "pattern": "^\\d{4}-\\d{2}-\\d{2}T\\d{2}:\\d{2}:\\d{2}Z$"
    },
    "last_refresh": {
      "anyOf": [
        {
          "type": "string",
          "pattern": "^\\d{4}-\\d{2}-\\d{2}T\\d{2}:\\d{2}:\\d{2}Z$"
        },
        {
          "type": "null"
        }
      ]
    },
    "previous_refresh": {
      "anyOf": [
        {
          "type": "string",
          "pattern": "^\\d{4}-\\d{2}-\\d{2}T\\d{2}:\\d{2}:\\d{2}Z$"
        },
        {
          "type": "null"
        }
      ]
    },
    "top_window_start": {
      "type": "string",
      "pattern": "^\\d{4}-\\d{2}-\\d{2}T\\d{2}:\\d{2}:\\d{2}Z$"
    },
    "timezone": {
      "type": "string"
    },
    "demo": {
      "type": "boolean"
    },
    "counts": {
      "type": "object",
      "properties": {
        "stories": {
          "type": "integer",
          "minimum": 0
        },
        "clusters": {
          "type": "integer",
          "minimum": 0
        },
        "deals": {
          "type": "integer",
          "minimum": 0
        },
        "firms": {
          "type": "integer",
          "minimum": 0
        }
      },
      "required": [
        "stories",
        "clusters",
        "deals",
        "firms"
      ],
      "additionalProperties": false
    },
    "sources_ok": {
      "type": "integer",
      "minimum": 0
    },
    "sources_total": {
      "type": "integer",
      "minimum": 0
    },
    "sources": {
      "type": "array",
      "items": {
        "type": "object",
        "properties": {
          "name": {
            "type": "string"
          },
          "ok": {
            "type": "boolean"
          },
          "method": {
            "type": "string"
          },
          "items_last_run": {
            "type": "integer",
            "minimum": 0
          }
        },
        "required": [
          "name",
          "ok",
          "method",
          "items_last_run"
        ],
        "additionalProperties": false
      }
    },
    "categories": {
      "type": "array",
      "items": {
        "type": "string",
        "minLength": 1
      }
    },
    "sec": {
      "type": "object",
      "properties": {
        "data_date": {
          "anyOf": [
            {
              "type": "string",
              "pattern": "^\\d{4}-\\d{2}-\\d{2}$"
            },
            {
              "type": "null"
            }
          ]
        },
        "firm_count": {
          "type": "integer",
          "minimum": 0
        }
      },
      "required": [
        "data_date",
        "firm_count"
      ],
      "additionalProperties": false
    },
    "digest": {
      "type": "object",
      "properties": {
        "date": {
          "type": "string",
          "pattern": "^\\d{4}-\\d{2}-\\d{2}$"
        },
        "ai": {
          "type": "boolean"
        },
        "last_good_date": {
          "anyOf": [
            {
              "type": "string",
              "pattern": "^\\d{4}-\\d{2}-\\d{2}$"
            },
            {
              "type": "null"
            }
          ]
        }
      },
      "required": [
        "date",
        "ai",
        "last_good_date"
      ],
      "additionalProperties": false
    },
    "footer_note": {
      "type": "string"
    },
    "industries": {
      "type": "array",
      "items": {
        "type": "string"
      },
      "minItems": 1
    }
  },
  "required": [
    "schema_version",
    "generated_at",
    "last_refresh",
    "previous_refresh",
    "top_window_start",
    "timezone",
    "demo",
    "counts",
    "sources_ok",
    "sources_total",
    "sources",
    "categories",
    "sec",
    "digest",
    "footer_note",
    "industries"
  ],
  "additionalProperties": false
}
